{
  "id": "apache-2.0",
  "name": "Apache License 2.0",
  "description": "A permissive open-source software license with explicit patent-related terms.",
  "category": "software-license",
  "spdx_id": "Apache-2.0",
  "license_family": "permissive",
  "commercial_use": "yes",
  "modification": "yes",
  "distribution": "yes",
  "patent_grant": "yes",
  "tags": ["open-source", "permissive", "software"],
  "sources": [
    {
      "title": "SPDX License List: Apache-2.0",
      "url": "https://spdx.org/licenses/Apache-2.0.html",
      "type": "reference",
      "last_checked": "2026-07-05"
    }
  ],
  "last_checked": "2026-07-05",
  "notes": "Initial summary only. This is not legal advice; verify the license text and obligations before use."
}
